{
  "schema_version": "2.0.0",
  "ticker": "ACME",
  "as_of": "2026-09-19",
  "latest_annual_period": "FY2025",
  "latest_balance_period": "Q2-2026",
  "margins": {
    "Q2-2026": {
      "gross": {
        "value": 0.4071428571,
        "unit": "fraction",
        "type": "fact",
        "status": "ok",
        "source_id": null,
        "derived_from": [
          "financials.Q2-2026.gross_profit",
          "financials.Q2-2026.revenue"
        ]
      },
      "operating": {
        "value": 0.1678571429,
        "unit": "fraction",
        "type": "fact",
        "status": "ok",
        "source_id": null,
        "derived_from": [
          "financials.Q2-2026.operating_income",
          "financials.Q2-2026.revenue"
        ]
      },
      "net": {
        "value": 0.1262857143,
        "unit": "fraction",
        "type": "fact",
        "status": "ok",
        "source_id": null,
        "derived_from": [
          "financials.Q2-2026.net_income",
          "financials.Q2-2026.revenue"
        ]
      },
      "fcf": {
        "value": 0.1142857143,
        "unit": "fraction",
        "type": "fact",
        "status": "ok",
        "source_id": null,
        "derived_from": [
          "financials.Q2-2026.op_cash_flow",
          "financials.Q2-2026.capex",
          "financials.Q2-2026.revenue"
        ]
      }
    },
    "FY2025": {
      "gross": {
        "value": 0.4,
        "unit": "fraction",
        "type": "fact",
        "status": "ok",
        "source_id": null,
        "derived_from": [
          "financials.FY2025.gross_profit",
          "financials.FY2025.revenue"
        ]
      },
      "operating": {
        "value": 0.16,
        "unit": "fraction",
        "type": "fact",
        "status": "ok",
        "source_id": null,
        "derived_from": [
          "financials.FY2025.operating_income",
          "financials.FY2025.revenue"
        ]
      },
      "net": {
        "value": 0.1184,
        "unit": "fraction",
        "type": "fact",
        "status": "ok",
        "source_id": null,
        "derived_from": [
          "financials.FY2025.net_income",
          "financials.FY2025.revenue"
        ]
      },
      "fcf": {
        "value": 0.12,
        "unit": "fraction",
        "type": "fact",
        "status": "ok",
        "source_id": null,
        "derived_from": [
          "financials.FY2025.op_cash_flow",
          "financials.FY2025.capex",
          "financials.FY2025.revenue"
        ]
      }
    },
    "FY2024": {
      "gross": {
        "value": 0.3888888889,
        "unit": "fraction",
        "type": "fact",
        "status": "ok",
        "source_id": null,
        "derived_from": [
          "financials.FY2024.gross_profit",
          "financials.FY2024.revenue"
        ]
      },
      "operating": {
        "value": 0.15,
        "unit": "fraction",
        "type": "fact",
        "status": "ok",
        "source_id": null,
        "derived_from": [
          "financials.FY2024.operating_income",
          "financials.FY2024.revenue"
        ]
      },
      "net": {
        "value": 0.1084444444,
        "unit": "fraction",
        "type": "fact",
        "status": "ok",
        "source_id": null,
        "derived_from": [
          "financials.FY2024.net_income",
          "financials.FY2024.revenue"
        ]
      },
      "fcf": {
        "value": 0.1066666667,
        "unit": "fraction",
        "type": "fact",
        "status": "ok",
        "source_id": null,
        "derived_from": [
          "financials.FY2024.op_cash_flow",
          "financials.FY2024.capex",
          "financials.FY2024.revenue"
        ]
      }
    },
    "FY2023": {
      "gross": {
        "value": 0.3756097561,
        "unit": "fraction",
        "type": "fact",
        "status": "ok",
        "source_id": null,
        "derived_from": [
          "financials.FY2023.gross_profit",
          "financials.FY2023.revenue"
        ]
      },
      "operating": {
        "value": 0.14,
        "unit": "fraction",
        "type": "fact",
        "status": "ok",
        "source_id": null,
        "derived_from": [
          "financials.FY2023.operating_income",
          "financials.FY2023.revenue"
        ]
      },
      "net": {
        "value": 0.0983414634,
        "unit": "fraction",
        "type": "fact",
        "status": "ok",
        "source_id": null,
        "derived_from": [
          "financials.FY2023.net_income",
          "financials.FY2023.revenue"
        ]
      },
      "fcf": {
        "value": 0.0975609756,
        "unit": "fraction",
        "type": "fact",
        "status": "ok",
        "source_id": null,
        "derived_from": [
          "financials.FY2023.op_cash_flow",
          "financials.FY2023.capex",
          "financials.FY2023.revenue"
        ]
      }
    }
  },
  "growth": {
    "FY2025": {
      "revenue_yoy": {
        "value": 0.1111111111,
        "unit": "fraction",
        "type": "fact",
        "status": "ok",
        "source_id": null,
        "derived_from": [
          "financials.FY2025.revenue",
          "financials.FY2024.revenue"
        ]
      },
      "eps_yoy": {
        "value": 0.243697479,
        "unit": "fraction",
        "type": "fact",
        "status": "ok",
        "source_id": null,
        "derived_from": [
          "financials.FY2025.eps_diluted",
          "financials.FY2024.eps_diluted"
        ]
      },
      "fcf_yoy": {
        "value": 0.25,
        "unit": "fraction",
        "type": "fact",
        "status": "ok",
        "source_id": null,
        "derived_from": [
          "financials.FY2025.op_cash_flow",
          "financials.FY2025.capex",
          "financials.FY2024.op_cash_flow",
          "financials.FY2024.capex"
        ]
      }
    },
    "FY2024": {
      "revenue_yoy": {
        "value": 0.0975609756,
        "unit": "fraction",
        "type": "fact",
        "status": "ok",
        "source_id": null,
        "derived_from": [
          "financials.FY2024.revenue",
          "financials.FY2023.revenue"
        ]
      },
      "eps_yoy": {
        "value": 0.2268041237,
        "unit": "fraction",
        "type": "fact",
        "status": "ok",
        "source_id": null,
        "derived_from": [
          "financials.FY2024.eps_diluted",
          "financials.FY2023.eps_diluted"
        ]
      },
      "fcf_yoy": {
        "value": 0.2,
        "unit": "fraction",
        "type": "fact",
        "status": "ok",
        "source_id": null,
        "derived_from": [
          "financials.FY2024.op_cash_flow",
          "financials.FY2024.capex",
          "financials.FY2023.op_cash_flow",
          "financials.FY2023.capex"
        ]
      }
    }
  },
  "cash_flow": {
    "fcf": {
      "value": 600000000,
      "unit": "usd",
      "type": "fact",
      "status": "ok",
      "source_id": null,
      "derived_from": [
        "financials.FY2025.op_cash_flow",
        "financials.FY2025.capex"
      ]
    },
    "fcf_conversion": {
      "value": 1.0135135135,
      "unit": "fraction",
      "type": "fact",
      "status": "ok",
      "source_id": null,
      "derived_from": [
        "cash_flow.fcf",
        "financials.FY2025.net_income"
      ]
    },
    "fcf_yield": {
      "value": 0.0303797468,
      "unit": "fraction",
      "type": "fact",
      "status": "ok",
      "source_id": null,
      "derived_from": [
        "cash_flow.fcf",
        "market.market_cap"
      ]
    },
    "capex_intensity": {
      "value": 0.05,
      "unit": "fraction",
      "type": "fact",
      "status": "ok",
      "source_id": null,
      "derived_from": [
        "financials.FY2025.capex",
        "financials.FY2025.revenue"
      ]
    },
    "ebitda": {
      "value": 1000000000,
      "unit": "usd",
      "type": "fact",
      "status": "ok",
      "source_id": null,
      "derived_from": [
        "financials.FY2025.operating_income",
        "financials.FY2025.depreciation_amortization"
      ]
    }
  },
  "balance_sheet": {
    "net_debt": {
      "value": 150000000,
      "unit": "usd",
      "type": "fact",
      "status": "ok",
      "source_id": null,
      "derived_from": [
        "financials.Q2-2026.total_debt",
        "financials.Q2-2026.cash"
      ]
    },
    "net_debt_to_ebitda": {
      "value": 0.15,
      "unit": "multiple",
      "type": "fact",
      "status": "ok",
      "source_id": null,
      "derived_from": [
        "balance_sheet.net_debt",
        "cash_flow.ebitda"
      ]
    },
    "interest_coverage": {
      "value": 13.3333333333,
      "unit": "multiple",
      "type": "fact",
      "status": "ok",
      "source_id": null,
      "derived_from": [
        "financials.FY2025.operating_income",
        "financials.FY2025.interest_expense"
      ]
    },
    "current_ratio": {
      "value": 1.8518518519,
      "unit": "ratio",
      "type": "fact",
      "status": "ok",
      "source_id": null,
      "derived_from": [
        "financials.Q2-2026.current_assets",
        "financials.Q2-2026.current_liabilities"
      ]
    }
  },
  "per_share": {
    "dilution_yoy": {
      "value": -0.0243902439,
      "unit": "fraction",
      "type": "fact",
      "status": "ok",
      "source_id": null,
      "derived_from": [
        "financials.FY2025.shares_diluted",
        "financials.FY2024.shares_diluted"
      ]
    },
    "sbc_pct_revenue": {
      "value": 0.02,
      "unit": "fraction",
      "type": "fact",
      "status": "ok",
      "source_id": null,
      "derived_from": [
        "financials.FY2025.sbc",
        "financials.FY2025.revenue"
      ]
    },
    "sbc_pct_fcf": {
      "value": 0.1666666667,
      "unit": "fraction",
      "type": "fact",
      "status": "ok",
      "source_id": null,
      "derived_from": [
        "financials.FY2025.sbc",
        "cash_flow.fcf"
      ]
    }
  },
  "quality_flags": [
    {
      "flag": "dso_rising",